{
  "update_id": "b1c2d3e4-0002-4000-8000-000000000002",
  "operation": "add_node",
  "timestamp": "2026-05-07T00:00:00Z",
  "author": "agent.constructor.v1",
  "node": {
    "node_id": "skill.kapelka.auditor",
    "label": "5 модулей навыков аудитора Kapelka",
    "type": "skill",
    "properties": {
      "agents": ["agent.auditor.kapelka.v1"],
      "modules": {
        "A": "frontend-auditor",
        "B": "security-auditor",
        "C": "integration-tester",
        "D": "devops-engineer",
        "E": "site-reliability-engineer"
      },
      "tools": ["Lighthouse", "npm audit", "testssl.sh", "gitleaks", "OWASP ZAP", "Anchor CLI", "certbot", "GitHub Actions"]
    }
  },
  "reason": "Навыки аудитора Kapelka для аудита React/Vite/Solana сайтов"
}
