{
  "update_id": "b1c2d3e4-0003-4000-8000-000000000003",
  "operation": "add_node",
  "timestamp": "2026-05-07T00:00:00Z",
  "author": "agent.constructor.v1",
  "node": {
    "node_id": "workflow.kapelka.full-cycle",
    "label": "Полный цикл Kapelka: Аудит → Исправление → Деплой → Поддержка",
    "type": "event",
    "properties": {
      "phases": {
        "0": "preparation",
        "1": "audit",
        "2": "fix",
        "3": "deploy",
        "4": "support"
      },
      "duration": {
        "audit": "3-5 days",
        "fix": "2-7 days",
        "deploy": "1-2 days",
        "support": "ongoing"
      },
      "sla": {
        "critical_response": "1 hour",
        "uptime": "99.5%",
        "lighthouse_min": 85
      }
    }
  },
  "reason": "Рабочий процесс Kapelka для обслуживания внешних заказчиков"
}
